data_id,name,data_classification,storage_system,record_count,pii_fields,regulatory_frameworks,backup_location,backup_frequency,retention_policy,data_owner,notification_requirements,notes
student-records,Student Records,confidential,sis-server,2400,"[""name"", ""dob"", ""address"", ""ssn_last4"", ""parent_name"", ""parent_phone"", ""medical_conditions"", ""iep_status""]","[""FERPA"", ""state_privacy_law""]",backup-server,Daily,7 years after graduation,Principal Johnson,FERPA: notify parents within 60 days of breach discovery,Includes IEP and 504 plan data
staff-records,Staff Personnel Records,confidential,ad-server,45,"[""name"", ""ssn"", ""dob"", ""address"", ""salary"", ""emergency_contacts"", ""medical_notes""]","[""state_employment_law""]",backup-server,Daily,7 years after separation,VP Martinez,State law: notify within 45 days,Includes payroll and benefits data
lunch-payments,Student Lunch Payment Data,restricted,payment-system,1800,"[""name"", ""parent_credit_card"", ""billing_address""]","[""PCI-DSS""]",Cloud (PaySchools),Real-time,3 years,Cafeteria Rosa,PCI-DSS: notify card brands within 72 hours,Credit card numbers tokenized by PaySchools
email-data,Staff and Student Email,internal,email-system,2500,"[""name"", ""email""]","[""FERPA""]",Google Vault,Continuous,5 years,Tech Jordan,FERPA applies to student email content,Google Workspace for Education
grades-data,Student Grades and Transcripts,confidential,sis-server,2400,"[""name"", ""grades"", ""gpa"", ""test_scores""]","[""FERPA""]",backup-server,Daily,Permanent,Principal Johnson,FERPA: notify parents within 60 days,Historical transcripts back to 2010
camera-footage,Security Camera Recordings,restricted,security-cameras,N/A,"[]","[""state_surveillance_law""]",Local NVR,Continuous,30 days rolling,Security Dave,N/A - no PII unless incident flagged,32 cameras. Footage pulled on request for incidents.
